{"$id":"pe4-ha-association-runtime-validation-correction.schema.json","$schema":"https://json-schema.org/draft/2020-12/schema","additionalProperties":false,"properties":{"deployment_performed_by_codex":{"const":false},"frozen_policy":{"const":"ACCEPTED_TREE_ONLY_NO_UNREVIEWED_PTH_OR_SITE_CUSTOMIZATION_USER_SITE_ENV_IGNORED_BY_ISOLATION"},"historical_adapter_commit":{"const":"5e9d1ff3d74bb22c6cc0c4f726517c1d0b86d7f2"},"historical_deployment_evidence_correction_commit":{"const":"2ef66a2d575c923c6939a4cd4d5bb2c8aab2f816"},"historical_deployment_preparation_commit":{"const":"0040bdc79e66c10db4f180f952d04f97b1070065"},"next_task":{"const":"PE-4 Home Assistant Association Adapter Deployment Execution"},"pi3_access_by_codex":{"const":false},"production_failure_evidence":{"additionalProperties":false,"properties":{"adapter_executed":{"const":false},"attempts":{"const":1},"deployment_transaction":{"const":"NOT_STARTED"},"error_code":{"const":"RUNTIME_DRIFT"},"ha_authentication_attempted":{"const":false},"ha_network_attempted":{"const":false},"label":{"const":"OPERATOR_SUPPLIED_PRODUCTION_EVIDENCE"},"production_deployment":{"const":"NOT_STARTED"},"production_mutation":{"const":false},"provenance":{"const":"OPERATOR_SUPPLIED"},"result":{"const":"FAIL"},"rollback":{"const":"NOT_PERFORMED"},"scheduler_deployment":{"const":"NOT_STARTED"}},"required":["adapter_executed","attempts","deployment_transaction","error_code","ha_authentication_attempted","ha_network_attempted","label","production_deployment","production_mutation","provenance","result","rollback","scheduler_deployment"],"type":"object"},"production_installation":{"const":false},"record_type":{"const":"PE4_HA_ASSOCIATION_RUNTIME_VALIDATION_CORRECTION"},"reviewed_pth":{"additionalProperties":false,"properties":{"authority":{"const":"REVIEWED_ACCEPTED_RUNTIME_COMPONENT"},"basename":{"const":"distutils-precedence.pth"},"content":{"const":"import os; var = 'SETUPTOOLS_USE_DISTUTILS'; enabled = os.environ.get(var, 'local') == 'local'; enabled and __import__('_distutils_hack').add_shim(); \n"},"distribution_record":{"additionalProperties":false,"properties":{"hash":{"const":"sha256=JjjOniUA5XKl4N5_rtZmHrVp0baW_LoHsN0iPaX10iQ"},"path":{"const":"distutils-precedence.pth"},"present":{"const":true},"size":{"const":151}},"required":["hash","path","present","size"],"type":"object"},"group":{"const":"jazofv1"},"links":{"const":1},"mode":{"const":"0640"},"owner":{"const":"jazofv1"},"path":{"const":"/home/jazofv1/hioc/runtime/pe4/environments/cpython311-websockets16.1.1-lock-v1/lib/python3.11/site-packages/distutils-precedence.pth"},"setuptools_version":{"const":"66.1.1"},"sha256":{"const":"2638ce9e2500e572a5e0de7faed6661eb569d1b696fcba07b0dd223da5f5d224"},"size":{"const":151},"total_pth_files":{"const":1},"type":{"const":"REGULAR_NO_SYMLINK"}},"required":["authority","basename","content","distribution_record","group","links","mode","owner","path","setuptools_version","sha256","size","total_pth_files","type"],"type":"object"},"reviewed_sitecustomize":{"additionalProperties":false,"properties":{"authority":{"const":"REVIEWED_SYSTEM_RUNTIME_COMPONENT"},"module_loaded":{"const":true},"module_path":{"const":"/usr/lib/python3.11/sitecustomize.py"},"package_provenance":{"additionalProperties":false,"properties":{"architecture":{"const":"arm64"},"authority":{"const":"OPERATOR_SUPPLIED_PROVENANCE"},"dpkg_output":{"const":"EMPTY"},"dpkg_returncode":{"const":0},"dpkg_verification":{"const":"PASS"},"md5":{"const":"d6b276695157bde06a56ba1b2bc53670"},"package":{"const":"libpython3.11-minimal:arm64"},"runtime_trust_anchor":{"const":false},"status":{"const":"install ok installed"},"version":{"const":"3.11.2-6+deb12u6"}},"required":["architecture","authority","dpkg_output","dpkg_returncode","dpkg_verification","md5","package","runtime_trust_anchor","status","version"],"type":"object"},"resolved_target":{"const":"/etc/python3.11/sitecustomize.py"},"symlink_group":{"const":"root"},"symlink_owner":{"const":"root"},"symlink_target":{"const":"/etc/python3.11/sitecustomize.py"},"target_content":{"const":"# install the apport exception handler if available\ntry:\n    import apport_python_hook\nexcept ImportError:\n    pass\nelse:\n    apport_python_hook.install()\n"},"target_group":{"const":"root"},"target_links":{"const":1},"target_mode":{"const":"0644"},"target_owner":{"const":"root"},"target_sha256":{"const":"43d81125d92376b1a69d53a71126a041cc9a18d8080e92dea0a2ae23be138b1e"},"target_size":{"const":155},"target_type":{"const":"REGULAR"},"type":{"const":"SYMLINK"}},"required":["authority","module_loaded","module_path","package_provenance","resolved_target","symlink_group","symlink_owner","symlink_target","target_content","target_group","target_links","target_mode","target_owner","target_sha256","target_size","target_type","type"],"type":"object"},"runtime_contract_consumption":{"const":false},"runtime_mutation":{"const":false},"schema_version":{"const":"1.0"},"shared_policy":{"const":"SHA256_BOUND_AST_EXTRACTION_OF_LITERAL_POLICY_AND_FOUR_VALIDATION_OBSERVATION_DEFINITIONS_NO_ADAPTER_IMPORT_OR_EXECUTION"},"sources":{"additionalProperties":false,"properties":{"deployment_helper":{"additionalProperties":false,"properties":{"git_blob":{"const":"7b2a058d97798f071c7f08d0b017b9409753f178"},"path":{"const":"tools/hioc-pe4-ha-association-deploy.py"},"sha256":{"const":"de9acf1504452bd6280cf410aa6aa1be4ae2b9f8f6fb77befa2d30ec07fc8bc8"}},"required":["git_blob","path","sha256"],"type":"object"},"entrypoint":{"additionalProperties":false,"properties":{"git_blob":{"const":"2864361fac7cd48e947dac1e4e40aeeeb525adef"},"path":{"const":"pi4/bin/hioc-home-assistant-association.py"},"sha256":{"const":"005fae482a4e2c42b48bfb991abf14ddf1d9de60f81169a2ed1573a767958b8c"}},"required":["git_blob","path","sha256"],"type":"object"},"module":{"additionalProperties":false,"properties":{"git_blob":{"const":"e71e4c45e21e9f1a25298471b48387cb19f53e1f"},"path":{"const":"pi4/lib/hioc/home_assistant_association.py"},"sha256":{"const":"9a9be5812f3481146de7546875320eb6adec65ca5a2b3230ff5fec378892c7c1"}},"required":["git_blob","path","sha256"],"type":"object"}},"required":["deployment_helper","entrypoint","module"],"type":"object"},"status":{"const":"PASS_CLOSED"},"usercustomize":{"const":"PROHIBITED"},"validation":{"additionalProperties":false,"properties":{"adapter_regression":{"const":73},"focused_tests":{"const":74},"kind":{"const":"REPOSITORY_ONLY_SYNTHETIC"},"other_regression":{"const":275},"runtime_correction_tests":{"const":8},"skip_reason":{"const":"Existing release rsync unavailable on Windows"},"total_passed":{"const":429},"total_run":{"const":430},"total_skipped":{"const":1}},"required":["adapter_regression","focused_tests","kind","other_regression","runtime_correction_tests","skip_reason","total_passed","total_run","total_skipped"],"type":"object"}},"required":["deployment_performed_by_codex","frozen_policy","historical_adapter_commit","historical_deployment_evidence_correction_commit","historical_deployment_preparation_commit","next_task","pi3_access_by_codex","production_failure_evidence","production_installation","record_type","reviewed_pth","reviewed_sitecustomize","runtime_contract_consumption","runtime_mutation","schema_version","shared_policy","sources","status","usercustomize","validation"],"type":"object"}
