{"deployment_performed_by_codex":false,"frozen_policy":"ACCEPTED_TREE_ONLY_NO_UNREVIEWED_PTH_OR_SITE_CUSTOMIZATION_USER_SITE_ENV_IGNORED_BY_ISOLATION","historical_adapter_commit":"5e9d1ff3d74bb22c6cc0c4f726517c1d0b86d7f2","historical_deployment_evidence_correction_commit":"2ef66a2d575c923c6939a4cd4d5bb2c8aab2f816","historical_deployment_preparation_commit":"0040bdc79e66c10db4f180f952d04f97b1070065","next_task":"PE-4 Home Assistant Association Adapter Deployment Execution","pi3_access_by_codex":false,"production_failure_evidence":{"adapter_executed":false,"attempts":1,"deployment_transaction":"NOT_STARTED","error_code":"RUNTIME_DRIFT","ha_authentication_attempted":false,"ha_network_attempted":false,"label":"OPERATOR_SUPPLIED_PRODUCTION_EVIDENCE","production_deployment":"NOT_STARTED","production_mutation":false,"provenance":"OPERATOR_SUPPLIED","result":"FAIL","rollback":"NOT_PERFORMED","scheduler_deployment":"NOT_STARTED"},"production_installation":false,"record_type":"PE4_HA_ASSOCIATION_RUNTIME_VALIDATION_CORRECTION","reviewed_pth":{"authority":"REVIEWED_ACCEPTED_RUNTIME_COMPONENT","basename":"distutils-precedence.pth","content":"import os; var = 'SETUPTOOLS_USE_DISTUTILS'; enabled = os.environ.get(var, 'local') == 'local'; enabled and __import__('_distutils_hack').add_shim(); \n","distribution_record":{"hash":"sha256=JjjOniUA5XKl4N5_rtZmHrVp0baW_LoHsN0iPaX10iQ","path":"distutils-precedence.pth","present":true,"size":151},"group":"jazofv1","links":1,"mode":"0640","owner":"jazofv1","path":"/home/jazofv1/hioc/runtime/pe4/environments/cpython311-websockets16.1.1-lock-v1/lib/python3.11/site-packages/distutils-precedence.pth","setuptools_version":"66.1.1","sha256":"2638ce9e2500e572a5e0de7faed6661eb569d1b696fcba07b0dd223da5f5d224","size":151,"total_pth_files":1,"type":"REGULAR_NO_SYMLINK"},"reviewed_sitecustomize":{"authority":"REVIEWED_SYSTEM_RUNTIME_COMPONENT","module_loaded":true,"module_path":"/usr/lib/python3.11/sitecustomize.py","package_provenance":{"architecture":"arm64","authority":"OPERATOR_SUPPLIED_PROVENANCE","dpkg_output":"EMPTY","dpkg_returncode":0,"dpkg_verification":"PASS","md5":"d6b276695157bde06a56ba1b2bc53670","package":"libpython3.11-minimal:arm64","runtime_trust_anchor":false,"status":"install ok installed","version":"3.11.2-6+deb12u6"},"resolved_target":"/etc/python3.11/sitecustomize.py","symlink_group":"root","symlink_owner":"root","symlink_target":"/etc/python3.11/sitecustomize.py","target_content":"# install the apport exception handler if available\ntry:\n    import apport_python_hook\nexcept ImportError:\n    pass\nelse:\n    apport_python_hook.install()\n","target_group":"root","target_links":1,"target_mode":"0644","target_owner":"root","target_sha256":"43d81125d92376b1a69d53a71126a041cc9a18d8080e92dea0a2ae23be138b1e","target_size":155,"target_type":"REGULAR","type":"SYMLINK"},"runtime_contract_consumption":false,"runtime_mutation":false,"schema_version":"1.0","shared_policy":"SHA256_BOUND_AST_EXTRACTION_OF_LITERAL_POLICY_AND_FOUR_VALIDATION_OBSERVATION_DEFINITIONS_NO_ADAPTER_IMPORT_OR_EXECUTION","sources":{"deployment_helper":{"git_blob":"7b2a058d97798f071c7f08d0b017b9409753f178","path":"tools/hioc-pe4-ha-association-deploy.py","sha256":"de9acf1504452bd6280cf410aa6aa1be4ae2b9f8f6fb77befa2d30ec07fc8bc8"},"entrypoint":{"git_blob":"2864361fac7cd48e947dac1e4e40aeeeb525adef","path":"pi4/bin/hioc-home-assistant-association.py","sha256":"005fae482a4e2c42b48bfb991abf14ddf1d9de60f81169a2ed1573a767958b8c"},"module":{"git_blob":"e71e4c45e21e9f1a25298471b48387cb19f53e1f","path":"pi4/lib/hioc/home_assistant_association.py","sha256":"9a9be5812f3481146de7546875320eb6adec65ca5a2b3230ff5fec378892c7c1"}},"status":"PASS_CLOSED","usercustomize":"PROHIBITED","validation":{"adapter_regression":73,"focused_tests":74,"kind":"REPOSITORY_ONLY_SYNTHETIC","other_regression":275,"runtime_correction_tests":8,"skip_reason":"Existing release rsync unavailable on Windows","total_passed":429,"total_run":430,"total_skipped":1}}
